NPI,Provider Name,Full Address,Phone,Specialty,Specialty_Classification,Specialty_Grouping,Latitude,Longitude
1083036826,BARRETT COUNSELING,"261 BROWNFIELD RD, DOUGLAS, WY 82633",3073583056,Addiction (Substance Use Disorder) Counselor,Counselor,Behavioral Health & Social Service Providers,42.756815047974,-105.387389613765
1184046849,GEOFFREY B TAYLOR DO CORP,"6550 E 2ND ST, CASPER, WY 82609",4067500743,Anesthesiology Physician,Anesthesiology,Allopathic & Osteopathic Physicians,42.839938164711,-106.22749931169
1538581137,"DUBOIS ASSISTED LIVING, INC","5643 US HIGHWAY 26, DUBOIS, WY 82513",3074552645,Assisted Living Facility,Assisted Living Facility,Nursing & Custodial Care Facilities,43.5272604,-109.6179416
1104249432,MISSION HEALTH SERVICES,"1445 UINTA DR, GREEN RIVER, WY 82935",8013891523,Skilled Nursing Facility,Skilled Nursing Facility,Nursing & Custodial Care Facilities,41.508499993522,-109.475596785003
1447673678,"BRIDGES HABILITATION SERVICES, INC.","400 S KENDRICK AVE, SUITE 101, GILLETTE, WY 82716",3076821261,Professional Counselor,Counselor,Behavioral Health & Social Service Providers,44.291175994739,-105.502559128716
1073936118,"ROBERTS AND HOPE CONSULTING, INC","1338 MONUMENT ST, CODY, WY 82414",3075874092,Nursing Care Agency,Nursing Care,Agencies,44.522853907906,-109.076601744699
1568885655,BANNER HEALTH PHYSICIANS WEST LLC,"2000 CAMPBELL DR, TORRINGTON, WY 82240",3075328758,Multi-Specialty Clinic/Center,Clinic/Center,Ambulatory Health Care Facilities,42.0827851,-104.1928929
1922421973,UNION PACIFIC EMERGENCY PHYSICIANS LLC,"214 E 23RD ST, CHEYENNE, WY 82001",3076342273,Emergency Medicine Physician,Emergency Medicine,Allopathic & Osteopathic Physicians,41.139899466867,-104.817007731281
1366865313,WYOMING EM-I MEDICAL SERVICES PC,"214 E 23RD ST, CHEYENNE, WY 82001",3076342273,Physician Assistant,Physician Assistant,Physician Assistants & Advanced Practice Nursing Providers,41.139899466867,-104.817007731281
1982027876,CDE LLC,"131 10TH ST, EVANSTON, WY 82930",3077894000,Community/Retail Pharmacy,Pharmacy,Suppliers,41.268221405779,-110.965253994304
1700209509,LANDER VALLEY SLEEP LAB LLC,"1510 MAIN ST, LANDER, WY 82520",3073496215,Durable Medical Equipment & Medical Supplies,Durable Medical Equipment & Medical Supplies,Suppliers,42.8421142,-108.7455744
1871916544,JEFFERY W. EDSTROM,"1524 W 5TH ST, SHERIDAN, WY 82801",3076727874,Certified Registered Nurse Anesthetist,"Nurse Anesthetist, Certified Registered",Physician Assistants & Advanced Practice Nursing Providers,44.807421252052,-106.978614416138
1013330794,SHERIDAN WYO DENTAL,"2 N MAIN ST STE 405, SHERIDAN, WY 82801",3076727439,General Practice Dentistry,Dentist,Dental Providers,44.797289398844,-106.955880462355
1720401383,YELLOWSTONE RECOVERY CENTER,"137 BELFRY HWY, CODY, WY 82414",3075863725,Adult Mental Health Clinic/Center,Clinic/Center,Ambulatory Health Care Facilities,44.541527184378,-109.069997257735
1861815581,BRYAN BENJAMIN COLLINS III,"907 N POPLAR ST STE 183, CASPER, WY 82601",3074729890,Clinical Social Worker,Social Worker,Behavioral Health & Social Service Providers,42.859695492161,-106.332573167405
1346663903,ASPIRE CASE MANAGEMENT SERVICES,"123 W 1ST ST # 700B, CASPER, WY 82601",3075770722,Case Management Agency,Case Management,Agencies,42.850027570628,-106.326108186036
1780007328,RACHEL YOCUM AS KIDS IN MOTION,"714 SAMUEL LN, CHEYENNE, WY 82009",3072866865,Occupational Therapist,Occupational Therapist,"Respiratory, Developmental, Rehabilitative and Restorative Service Providers",41.188676238038,-104.816912180966
1447673082,KROSS FIRE COUNSELING & EQUINE ENTERPRISES,"919 AIRPORT RD, SHERIDAN, WY 82801",3077513769,Addiction (Substance Use Disorder) Counselor,Counselor,Behavioral Health & Social Service Providers,44.777303931438,-106.969690097639
1639593080,"CAPITOL COUNSELING, LLC","1918 THOMES AVE, CHEYENNE, WY 82001",3076315574,Clinical Social Worker,Social Worker,Behavioral Health & Social Service Providers,41.13430778074,-104.820564113372
1992129225,RONALD F HOOPES LPC,"1210 WEST BRIDGE STREET, SARATOGA, WY 82331",3077603700,Professional Counselor,Counselor,Behavioral Health & Social Service Providers,41.4549621,-106.8064263
1740604057,"LIV IN-HOME COUNSELING & CARE MANAGEMENT, LLC","2500 DELL RANGE BLVD, CHEYENNE, WY 82009",3076304729,Clinical Psychologist,Psychologist,Behavioral Health & Social Service Providers,41.160218669558,-104.779695663712
1124442249,"AURALCARE HEARING CENTERS OF AMERICA, LLC","106 S MAIN STREET, 1, LYMAN, WY 82937",3072885165,Hearing and Speech Clinic/Center,Clinic/Center,Ambulatory Health Care Facilities,41.326397146431,-110.29299481368
1194149849,GILBERT & REHER LLC,"1506 THOMES AVE, SUITE E, CHEYENNE, WY 82001",3075146324,Pharmacist,Pharmacist,Pharmacy Service Providers,41.130680752513,-104.818202444633
1215352877,PEGASUS CASE MANAGEMENT,"22 ANTELOPE DR, BEAR RIVER, WY 82930",3077893113,Case Management Agency,Case Management,Agencies,41.376302530654,-111.034698210265
1740605088,TAILORED NUTRITION LLC,"37 S MAIN ST, SHERIDAN, WY 82801",3077528213,Health Service Clinic/Center,Clinic/Center,Ambulatory Health Care Facilities,44.796888185227,-106.955729010392
1538584750,MICHAELA R SISNEROS,"2890 COOPER RD, RIVERTON, WY 82501",3078513184,Nursing Care Agency,Nursing Care,Agencies,43.041186299707,-108.432308956433
1982029773,AMANDA LUKEHART AND ROBBIE HOLDEMAN LLC,"510 S BROOKS AVE, GILLETTE, WY 82716",3076602773,Case Management Agency,Case Management,Agencies,44.290148587752,-105.496787802155
1992120604,"SUMMERS HELPING HANDS, LLC","2105 LILAC LN, JACKSON, WY 83001",3077974381,Registered Nurse First Assistant,Registered Nurse,Nursing Service Providers,43.461062612196,-110.807123737926
1437575057,"LARAMIE HEARING AID CLINIC, LLC","204 MCCOLLUM ST STE 107, LARAMIE, WY 82070",3077424327,Hearing  Aid Equipment,Hearing Aid Equipment,Suppliers,41.310984327022,-105.555349591102
1386060903,CAMPBELL COUNTY HOSPITAL DISTRICT,"501 S BURMA AVE, 3RD FLOOR NORTH, GILLETTE, WY 82716",3076883700,Cardiovascular Disease Physician,Internal Medicine,Allopathic & Osteopathic Physicians,44.290417722206,-105.51945260029
1790101947,CAMPBELL COUNTY HOSPITAL DISTRICT,"702 S KENDRICK AVE, GILLETTE, WY 82716",3076888700,Pediatrics Physician,Pediatrics,Allopathic & Osteopathic Physicians,44.288211101617,-105.502501684411
1386060424,QUALITY CASE MANAGEMENT INC,"138 EAST 7TH AVE, AFTON, WY 83110",3072488083,Case Management Agency,Case Management,Agencies,42.72007061767,-110.927418982053
1396162046,TAKE TIME COUNSELING,"2510 E 15TH ST, SUITE11, CASPER, WY 82609",3072622787,Addiction (Substance Use Disorder) Counselor,Counselor,Behavioral Health & Social Service Providers,42.835397572672,-106.294025761094
1710304399,"A KEELER FAMILY DENTAL, LLC","1010 E RICHARDS STREET, DOUGLAS, WY 82633",3073581720,Dentist,Dentist,Dental Providers,42.748511510428,-105.374398131668
1619394889,HANGER PROSTHETICS & ORTHOTICS INC,"7350 STOCKMAN ST STE B, CHEYENNE, WY 82009",3072221724,Durable Medical Equipment & Medical Supplies,Durable Medical Equipment & Medical Supplies,Suppliers,41.18529734574,-104.836257871785
1952729857,"BRIDGER VALLEY URGENT CARE, LLC","3580 STATE HIGHWAY 414, LYMAN, WY 82937",2085429111,Emergency Medicine Physician,Emergency Medicine,Allopathic & Osteopathic Physicians,41.316432073512,-110.336141224517
1003234774,MINDFULLY RECONNECT,"2321 DUNN AVE, CHEYENNE, WY 82001",3076401008,Community/Behavioral Health Agency,Community/Behavioral Health,Agencies,41.145014060818,-104.803705763429
1366860942,WORLAND PHYSICAL THERAPY,"120 S 17TH ST, WORLAND, WY 82401",3073474001,Physical Therapy Clinic/Center,Clinic/Center,Ambulatory Health Care Facilities,44.015947979626,-107.945852190536
1174941520,"RIVERTON MEMORIAL HOSPITAL, LLC","2100 W SUNSET DR, RIVERTON, WY 82501",3078564161,Psychiatric Hospital Unit,Psychiatric Unit,Hospital Units,43.033713314744,-108.417310738581
1780002089,"LS COUNSELING & PSYCHOEDUCATIONAL SERVICES, LLC","1800 EDINBURGH ST., RAWLINS, WY 82301",3073248820,Case Manager/Care Coordinator,Case Manager/Care Coordinator,Other Service Providers,41.804926375833,-107.21940249667
1295153591,"RIVERTON MEMORIAL HOSPITAL, LLC","2100 W SUNSET DR, RIVERTON, WY 82501",3078564161,Rehabilitation Hospital Unit,Rehabilitation Unit,Hospital Units,43.033713314744,-108.417310738581
1174942577,WRAP AROUND WYOMING INC,"916 RANGER DR, CHEYENNE, WY 82009",3077106296,Case Management Agency,Case Management,Agencies,41.180014850601,-104.846407246333
1457770679,"BEST CHOICE CASE MANAGEMENT, LLP","903 TRIGOOD DR, CASPER, WY 82609",3072678878,Case Management Agency,Case Management,Agencies,42.84162997075,-106.284444096147
1811317910,"ADVANCING OPPORTUNITIES, LLC","4341 BOBCAT, CASPER, WY 82604",3072773158,Developmentally Disabled Services Day Training Agency,"Day Training, Developmentally Disabled Services",Agencies,42.808245659056,-106.366744072098
1538588645,PRATT - LOVERCHECK PRACTICE,"231 CAMINO DEL REY, TORRINGTON, WY 82240",3075345582,Clinical Social Worker,Social Worker,Behavioral Health & Social Service Providers,42.079518815443,-104.186327159803
1477973436,"ACHIEVING OPPORTUNITIES, LLC","4341 BOBCAT, CASPER, WY 82604",3072773158,Community/Behavioral Health Agency,Community/Behavioral Health,Agencies,42.808245659056,-106.366744072098
1548680440,"WESTERN PLAINS CHIROPRACTIC, LLC","900 EZ ST STE 120, GILLETTE, WY 82718",3076826650,Chiropractor,Chiropractor,Chiropractic Providers,44.272776520302,-105.491582799684
1295155190,MOUNTAIN WEST SPEECH SERVICES LLC,"8957 KOOPER TRL, CHEYENNE, WY 82009",3073992876,Speech-Language Pathologist,Speech-Language Pathologist,"Speech, Language and Hearing Service Providers",41.1875116885,-104.698216100676
1013337880,"MOUNTAIN REGIONAL SERVICES, INC","50 ALLEGIANCE CIR, EVANSTON, WY 82930",3077789371,Skilled Nursing Facility,Skilled Nursing Facility,Nursing & Custodial Care Facilities,41.260596674219,-110.993850351655
1689084360,ALPINE MEDICAL,"3100 BIG HORN AVE, CODY, WY 82414",3078993733,Durable Medical Equipment & Medical Supplies,Durable Medical Equipment & Medical Supplies,Suppliers,44.533384460182,-109.02879102069
1366853418,GIDDY UP WELLNESS & THERAPY SERVICES,"1949 SUGARLAND DRIVE, SUITE 200, SHERIDAN, WY 82801",3074619891,Physical Therapy Clinic/Center,Clinic/Center,Ambulatory Health Care Facilities,44.776689995958,-106.939487511737
1447661319,PREMISE HEALTH OF WYOMING MEDICAL PC,"2723 CHRISTENSEN RD, CHEYENNE, WY 82007",3076370736,Multi-Specialty Clinic/Center,Clinic/Center,Ambulatory Health Care Facilities,41.141380594501,-104.710584494339
1326459835,JACOB G. DESPAIN OD PC,"426 NEVADA AVE, LOVELL, WY 82431",3075487450,Optometrist,Optometrist,Eye and Vision Services Providers,44.837051012524,-108.389368683228
1104237601,JACOB G. DESPAIN OD PC,"1708 STAMPEDE AVE, CODY, WY 82414",3075872404,Optometrist,Optometrist,Eye and Vision Services Providers,44.518769020561,-109.053640147538
1952713158,CASPER CARE SOLUTIONS LLC,"4050 S POPLAR ST, CASPER, WY 82601",3072514432,In Home Supportive Care Agency,In Home Supportive Care,Agencies,42.807128376701,-106.344648390556
1740692748,INSTITUTE FOR ASPIRE HUMAN DYNAMIC COMMUNITY HEALTHCARE SERVICES,"203 S 2ND ST, LARAMIE, WY 82070",8669260035,Community/Behavioral Health Agency,Community/Behavioral Health,Agencies,41.311982613893,-105.594734648939
1265844120,"AURALCARE HEARING CENTERS OF AMERICA, LLC","1453 DEWAR DR UNIT A, ROCK SPRINGS, WY 82901",3072230048,Hearing and Speech Clinic/Center,Clinic/Center,Ambulatory Health Care Facilities,41.575189651612,-109.239272527876
1487067229,"EYE CARE FOR YOU, LLC","426 GREYBULL AVE, GREYBULL, WY 82426",3077652998,Optometrist,Optometrist,Eye and Vision Services Providers,44.48892625007,-108.05294401093
1114330750,RHOADES DENTAL P.C.,"17 S SENECA AVE, NEWCASTLE, WY 82701",3077464772,Dentist,Dentist,Dental Providers,43.854643555706,-104.204155620439
1972917094,"CORE PHYSICAL THERAPY, LLC","51 E 1ST ST, SHERIDAN, WY 82801",4062356088,Physical Therapist,Physical Therapist,"Respiratory, Developmental, Rehabilitative and Restorative Service Providers",44.802864759175,-106.955103235415
1003220096,BRAIN INJURY ASSOCIATION OF WYOMING,"350 BIG HORN RD STE 101, CASPER, WY 82601",3074731767,Behavior Analyst,Behavior Analyst,Behavioral Health & Social Service Providers,42.854268153073,-106.335212200135
1710392220,"BRIDGES HABILITATION SERVICES, INC.","400 S KENDRICK AVE, SUITE 201D, GILLETTE, WY 82716",3076857105,Mental Health Clinic/Center (Including Community Mental Health Center),Clinic/Center,Ambulatory Health Care Facilities,44.291175994739,-105.502559128716
1629483813,ROCKY MOUNTAIN FAMILY DENTAL,"956 12TH ST, CODY, WY 82414",3075875588,Dentist,Dentist,Dental Providers,44.52740509695,-109.063913226144
1346655164,CROSSROADS COUNSELING LLC,"2510 E 15TH ST, SUITE 11, CASPER, WY 82609",3072772753,Community/Behavioral Health Agency,Community/Behavioral Health,Agencies,42.835397572672,-106.294025761094
1265848774,PEDIATRIC DENTISTRY LLC,"1439 STILLWATER AVE STE 7, CHEYENNE, WY 82009",3077787100,Pediatric Dentistry,Dentist,Dental Providers,41.159710436749,-104.806401763005
1619383148,"UINTA EMERGENCY PHYSICIANS, LLC","190 ARROWHEAD DR, EVANSTON, WY 82930",3077893636,Emergency Medical Services (Emergency Medicine) Physician,Emergency Medicine,Allopathic & Osteopathic Physicians,41.242272133687,-110.991260184541
1265848691,"INTEGRATED ORTHO, LLC","970 W BROADWAY, 408, JACKSON, WY 83001",8773989540,Durable Medical Equipment & Medical Supplies,Durable Medical Equipment & Medical Supplies,Suppliers,43.479636773764,-110.743555782581
1831505262,"ADVANCED PRACTICE, LLC","733 BIG HORN AVE, SUITE 1, WORLAND, WY 82401",8885044074,Psychiatric/Mental Health Nurse Practitioner,Nurse Practitioner,Physician Assistants & Advanced Practice Nursing Providers,44.01688157219,-107.959372906933
1053727255,"VETRAS TORRINGTON SNF, LLC","2009 LARAMIE ST, TORRINGTON, WY 82240",3075324038,Skilled Nursing Facility,Skilled Nursing Facility,Nursing & Custodial Care Facilities,42.0826599,-104.1942582
1578979688,90TH MEDGRP-FE WARREN,"6900 ALDEN DR BLDG 160, FE WARREN AFB, WY 82005",3077733638,Military/U.S. Coast Guard Pharmacy,Military/U.S. Coast Guard Pharmacy,Suppliers,41.158280864445,-104.862856661563
1831505973,ERICKSON FAMILY DENTAL,"130 S SENECA AVE, NEWCASTLE, WY 82701",3077464600,General Practice Dentistry,Dentist,Dental Providers,43.853535573064,-104.203494763124
1942616941,"FAMILY DENTISTRY, P.C.","2017 CAMPBELL DR, TORRINGTON, WY 82240",3075324448,Dentist,Dentist,Dental Providers,42.082114949909,-104.19141765592
1114333127,"CASPER CHILDREN'S CENTER, LLC","2222 E 2ND ST, CASPER, WY 82609",3075774260,Pediatrics Physician,Pediatrics,Allopathic & Osteopathic Physicians,42.848789571191,-106.295860531302
1770990616,OSAGE VOLUNTEER FIRE DEPARTMENT,"463 NEFSY AVE, OSAGE, WY 82723",3076892347,Land Ambulance,Ambulance,Transportation Services,43.979604412094,-104.420961244482
1770990426,RENDEZVOUS MEDICAL,"1035 ROSE LN, SUITE D, RIVERTON, WY 82501",3078560382,Clinic/Center,Clinic/Center,Ambulatory Health Care Facilities,43.0358534,-108.4188966
1932516358,"JANET HOYT, LLC","1651 BRENTWOOD DR, CASPER, WY 82604",3072510077,Community/Behavioral Health Agency,Community/Behavioral Health,Agencies,42.818813738211,-106.344516817651
1548677701,WIND RIVER PHYSICAL THERAPY LLC,"150 LINCOLN ST, LANDER, WY 82520",3073355188,Specialist,Specialist,Other Service Providers,42.833635057781,-108.727793423533
1902213093,WHITE BUFFALO RECOVERY CENTER,"#22 GREAT PLAINS RD, ARAPAHOE, WY 82510",3078560470,Substance Use Disorder Rehabilitation Clinic/Center,Clinic/Center,Ambulatory Health Care Facilities,42.983915455595,-108.484879844515
1871901413,"CASPER MEDICAL CENTER, LLC","6550 E 2ND ST, CASPER, WY 82609",3079958100,Special Hospital,Special Hospital,Hospitals,42.839938164711,-106.22749931169
1629486865,"SOAR COUNSELING SERVICES, INC.","1507 BECK AVE, CODY, WY 82414",3075863783,Substance Use Disorder Rehabilitation Clinic/Center,Clinic/Center,Ambulatory Health Care Facilities,44.525003611679,-109.058036101642
1184032302,INFINITE HORIZON CHIROPRACTIC,"504 PINE ST., APT. 7, UPTON, WY 82730",3073633859,Chiropractor,Chiropractor,Chiropractic Providers,44.098211262764,-104.627393092464
1013325182,WALMART INC.,"2390 E CEDAR ST, RAWLINS, WY 82301",3074173058,Durable Medical Equipment & Medical Supplies,Durable Medical Equipment & Medical Supplies,Suppliers,41.792108504634,-107.215966891169
1699184739,HEALTHWORKS,"2508 E FOX FARM RD, 1-1A, CHEYENNE, WY 82007",3076353618,Primary Care Clinic/Center,Clinic/Center,Ambulatory Health Care Facilities,41.116685674679,-104.770677437613
1659780336,SHOSHONI SENIOR CITIZENS CENTER,"214 E. 2ND, SHOSHONI, WY 82649",3078762703,Case Management Agency,Case Management,Agencies,43.235573673198,-108.109057566711
1477962074,"RESCARE BEHAVIOR SERVICES, INC.","2113 STEVE AVE, SUITE 8, CHEYENNE, WY 82007",5023942100,Community/Behavioral Health Agency,Community/Behavioral Health,Agencies,41.098192765068,-104.802992964918
1114336781,SUMMIT SPINE AND NEUROSURGERY ASSOCIATES,"2301 HOUSE AVE, SUITE 505, CHEYENNE, WY 82001",3076329261,Neurological Surgery Physician,Neurological Surgery,Allopathic & Osteopathic Physicians,41.139788061285,-104.815607397562
1619386901,KMART PHARMACY,"4000 EAST 2ND, CASPER, WY 82609",3072651331,Community/Retail Pharmacy,Pharmacy,Suppliers,42.848969569543,-106.275518754668
1245649458,"WORLAND SLEEP DIAGNOSTICS,LLC","1123 BIG HORN AVE, SUITE C, WORLAND, WY 82401",3073473070,Sleep Disorder Diagnostic Clinic/Center,Clinic/Center,Ambulatory Health Care Facilities,44.016888259149,-107.954012398528
1538568332,CROSSROADS COUNSELING & CASE MANAGEMENT LLC,"798 S FREMONT, PINEDALE, WY 82941",3072316853,Case Management Agency,Case Management,Agencies,42.857935542462,-109.856006042973
1508265364,WYOMING PREMIER ANESTHESIA,"1233 E 2ND ST, CASPER, WY 82601",4352295866,Anesthesiology Physician,Anesthesiology,Allopathic & Osteopathic Physicians,42.848710980844,-106.308874923041
1730588591,SWEET GRASS ACUPUNCTURE & WELLNESS,"604 W MAIN ST, RIVERTON, WY 82501",3078568800,Acupuncturist,Acupuncturist,Other Service Providers,43.024666878051,-108.397755193692
1891194494,"SWEETWATER COUNTY CHC, INC","2620 COMMERCIAL WAY, ROCK SPRINGS, WY 82901",3072124241,Community/Retail Pharmacy,Pharmacy,Suppliers,41.581805992145,-109.255749708537
1699174144,"LET'SGETTHINMD, LLC","5890 E 2ND ST, CASPER, WY 82609",8848808446,Obesity Medicine (Family Medicine) Physician,Family Medicine,Allopathic & Osteopathic Physicians,42.84369305526,-106.23819235609
1902205339,"CONNECT HEARING, INC.","1921 WARREN AVE, CHEYENNE, WY 82001",3076344100,Hearing Instrument Specialist,Hearing Instrument Specialist,"Speech, Language and Hearing Service Providers",41.136465310943,-104.814845720045
1689074593,MARILYN M BECK CSW,"2315 DUNN AVE, CHEYENNE, WY 82001",3072876206,Social Worker,Social Worker,Behavioral Health & Social Service Providers,41.144966923865,-104.803675391691
1881095966,SMITH'S FOOD AND DRUG PHARMACY #187,"905 BRIDGER DR, GREEN RIVER, WY 82935",3078757841,Pharmacist,Pharmacist,Pharmacy Service Providers,41.503316982778,-109.458975007717
1609277227,"EMILY SIEGEL, LCSW PC","507 S 4TH ST, LARAMIE, WY 82070",3073994508,Clinical Social Worker,Social Worker,Behavioral Health & Social Service Providers,41.308936275676,-105.592440463913
1962804443,"BARKER FAMILY HEALTH, LLC","191 OVERTHRUST RD, EVANSTON, WY 82930",3077898721,Family Nurse Practitioner,Nurse Practitioner,Physician Assistants & Advanced Practice Nursing Providers,41.257514264572,-110.985151405633
1588067037,WYOMING WELLNESS LLP,"112 E. BRIDGE, SUITE G, SARATOGA, WY 82331",3076314912,Community/Behavioral Health Agency,Community/Behavioral Health,Agencies,41.454878783242,-106.807430984373
1801299912,EYES ON FREMONT LLC,"704 E FREMONT AVE, RIVERTON, WY 82501",3078569000,Optometrist,Optometrist,Eye and Vision Services Providers,43.025792719779,-108.381885613678
1407259591,PRECISION HEARING,"3953 LEGION LN, CASPER, WY 82609",3072375813,Hearing  Aid Equipment,Hearing Aid Equipment,Suppliers,42.851438437683,-106.276552123071
1316340417,UNIVERSITY OF WYOMING,"117 E 4TH ST, PINE BLUFFS, WY 82082",3072453666,Clinic/Center,Clinic/Center,Ambulatory Health Care Facilities,41.180927614741,-104.067972362582
1295138972,KODIAK ANESTHESIA PC,"4850 CHINOOK TRL, CASPER, WY 82604",3074738173,Anesthesiology Physician,Anesthesiology,Allopathic & Osteopathic Physicians,42.804139463986,-106.346777762668
1497158182,"YOUTH CRISIS CENTER, INC","1656 E 12TH ST, CASPER, WY 82601",3075775718,Mental Health Counselor,Counselor,Behavioral Health & Social Service Providers,42.838898573014,-106.303633151534
1851795538,BRIO AND BALANCE COUNSELING,"687 AVENUE J, POWELL, WY 82435",2538205278,Community/Behavioral Health Agency,Community/Behavioral Health,Agencies,44.757797561418,-108.768741001264
1730583295,UNIVERSITY OF UTAH EMERGENCY PHYSICIANS,"1200 COLLEGE DR, ROCK SPRINGS, WY 82901",3073523711,Emergency Medicine Physician,Emergency Medicine,Allopathic & Osteopathic Physicians,41.5847931,-109.2357623
1962806331,MOSS DENTISTRY,"203 E MAIN STREET, SUITE 205, RIVERTON, WY 82501",3078572020,General Practice Dentistry,Dentist,Dental Providers,43.024580129116,-108.389098577901
1417351602,ASPEN HILLS DENTAL LLC,"800 SOUTH WASHINGTON ST., AFTON, WY 83110",3078854337,Dentist,Dentist,Dental Providers,42.716123375145,-110.933589161427
1790189611,"ROCKY MOUNTAIN HOLDINGS, LLC","1200 COLLEGE DR, ROCK SPRINGS, WY 82901",8886364438,Air Ambulance,Ambulance,Transportation Services,41.5847931,-109.2357623
1134524986,PRIORITY DENTAL,"1224 E 2ND ST, CASPER, WY 82601",3073336285,Dentist,Dentist,Dental Providers,42.84882557224,-106.309032279749
1578968152,"SEPPIE PHYSICAL THERAPY, LLC","416 W BLAIR AVE, ROCK SPRINGS, WY 82901",3073823242,Physical Therapist,Physical Therapist,"Respiratory, Developmental, Rehabilitative and Restorative Service Providers",41.576536241417,-109.225847707383
1295130631,BIGHORN ORTHODONTICS LLC,"642 VAL VISTA ST, SUITE B, SHERIDAN, WY 82801",3076726917,Orthodontics and Dentofacial Orthopedics Dentistry,Dentist,Dental Providers,44.8042525733,-106.957252970347
1801291083,"LUKEHART & PIERSON COUNSELING, LLC","4418 DOUD DR, GILLETTE, WY 82718",6053810068,Mental Health Counselor,Counselor,Behavioral Health & Social Service Providers,44.253716379036,-105.554948970296
1952706822,SWEETWATER COUNSELING,"3211 ENERGY LN STE 402, CASPER, WY 82604",3073373797,Professional Counselor,Counselor,Behavioral Health & Social Service Providers,42.818044180121,-106.381239668242
1184020950,CAMPBELL COUNTY CLINICS FAMILY PRACTICE,"501 S BURMA AVE, GILLETTE, WY 82716",3076883636,Family Medicine Physician,Family Medicine,Allopathic & Osteopathic Physicians,44.290417722206,-105.51945260029
1033515721,"ROCKY MOUNTAIN RADIOLOGY SERVICES, LLC","777 AVENUE H, POWELL, WY 82435",3077542267,Diagnostic Radiology Physician,Radiology,Allopathic & Osteopathic Physicians,44.756704681467,-108.770425610152
1366848970,CB CASE MANAGEMENT LLC,"125 E 8TH ST, CASPER, WY 82601",3072626347,Case Management Agency,Case Management,Agencies,42.842554982878,-106.324961694757
1538565924,WYOMING CARDIAC AND THORACIC SURGERY,"805 E 2ND ST, CASPER, WY 82601",3072372300,Thoracic Surgery (Cardiothoracic Vascular Surgery) Physician,Thoracic Surgery (Cardiothoracic Vascular Surgery),Allopathic & Osteopathic Physicians,42.848677447359,-106.31514665645
1417353517,"PHARMAKON SOLUTIONS, LLC","1621 CENTRAL AVE, CHEYENNE, WY 82001",9496379328,Case Management Agency,Case Management,Agencies,41.133373252538,-104.814231048492
1053718692,"YELLOWSTONE PHYSICAL THERAPY, P.C.","622 AVENUE B, POWELL, WY 82435",3078994334,Physical Therapist,Physical Therapist,"Respiratory, Developmental, Rehabilitative and Restorative Service Providers",44.750734970735,-108.768302624385
1306243829,OASIS MEDICAL LLC,"325 FRONT ST, #330, EVANSTON, WY 82930",8772547838,Customized Equipment (DME),Durable Medical Equipment & Medical Supplies,Suppliers,41.263580623769,-110.958432214163
1215335179,"CASPER GENERAL SURGERY, LLC","1540 CENTENNIAL CT UNIT 300, CASPER, WY 82609",3073374981,Surgery Physician,Surgery,Allopathic & Osteopathic Physicians,42.833965628164,-106.270926647549
1629476270,COMMUNITY PHARMACIES INC,"224 E MAIN STREET, SUNDANCE, WY 82729",3072833883,Long Term Care Pharmacy,Pharmacy,Suppliers,44.405272365752,-104.380715106056
1427456854,"JONATHAN MORGAN DDS, PC","50 ARROWHEAD DR, EVANSTON, WY 82930",3077895210,General Practice Dentistry,Dentist,Dental Providers,41.242290133322,-110.98667663374
1346648656,"TANNER FAMILY DENTISTRY, DEVIN K. TANNER DDS, LLC","220 SHOSHONE AVE, GREEN RIVER, WY 82935",3078757770,General Practice Dentistry,Dentist,Dental Providers,41.507797135966,-109.469247180264
1326446568,QUALITY CASE MANAGEMENT,"280 S WASHINGTON, AFTON, WY 83110",3078865234,Developmentally Disabled Services Day Training Agency,"Day Training, Developmentally Disabled Services",Agencies,42.727834222153,-110.93344038773
1063800035,LCR DENTAL ROCK SPRINGS LLC,"657 PILOT BUTTE AVE, ROCK SPRINGS, WY 82901",3073623125,Dentist,Dentist,Dental Providers,41.589876240767,-109.21963318299
1639567449,"OSI JACKSON HOLE, LLC","3000 W BIG TRAIL DR, JACKSON, WY 83001",3077340500,Case Management Agency,Case Management,Agencies,43.436409394187,-110.787362999037
1639567233,JOANNA BALLARD HOME MIDWIFERY CARE,"421 S 19TH ST, LARAMIE, WY 82070",3072566633,Midwife,Midwife,Other Service Providers,41.308718264822,-105.57158736459
1184012858,HEATHER HAWKINS,"4322 MIDDLE FORK TRL, CHEYENNE, WY 82007",3076400772,Developmentally Disabled Services Day Training Agency,"Day Training, Developmentally Disabled Services",Agencies,41.078093311125,-104.803952817066
1275921843,CODY CHIROPRACTIC CENTER PC,"1708 STAMPEDE AVE, SUITE C, CODY, WY 82414",3075875591,Chiropractor,Chiropractor,Chiropractic Providers,44.518769020561,-109.053640147538
