NPI,Provider Name,Full Address,Phone,Specialty,Specialty_Classification,Specialty_Grouping,Latitude,Longitude
1710190806,"SHERWOOD GROUP, INC","509 FORT ST STE B, BUFFALO, WY 82834",3076848623,Occupational Therapist,Occupational Therapist,"Respiratory, Developmental, Rehabilitative and Restorative Service Providers",44.3480627,-106.7054204
1457565897,B. LAWRENCE BENNETT DDS PC,"201 W LAKEWAY RD STE 517, GILLETTE, WY 82718",7195510556,Dentist,Dentist,Dental Providers,44.268971652584,-105.505396627714
1275747628,TETON HAND THERAPY LLC,"310 EAST BROADWAY, JACKSON, WY 83001",3077342877,Durable Medical Equipment & Medical Supplies,Durable Medical Equipment & Medical Supplies,Suppliers,43.479559493069,-110.756535380009
1982818233,ANDREW F HALL MD,"350 S BROOKS ST, SHERIDAN, WY 82801",3076744449,Ophthalmology Physician,Ophthalmology,Allopathic & Osteopathic Physicians,44.794114816272,-106.957273273035
1366656522,I-REACH 2 INC,"351 N LENNOX ST, CASPER, WY 82601",3072658086,Developmentally Disabled Services Day Training Agency,"Day Training, Developmentally Disabled Services",Agencies,42.853550451368,-106.299583583507
1891909198,RIDLEYS FAMILY MARKETS INC,"341 EAST PINE ST, PINEDALE, WY 82941",3073674451,Pharmacy,Pharmacy,Suppliers,42.8672625,-109.8561288
1114131794,"HIGH COUNTRY HEALTH, INC","3131 E GRAND AVE UNIT A, LARAMIE, WY 82070",3077423120,Home Health Agency,Home Health,Agencies,41.30897647044,-105.556215816557
1023222601,"HIGH COUNTRY HEALTH, INC","3131 E GRAND AVE UNIT A, LARAMIE, WY 82070",3077423120,Durable Medical Equipment & Medical Supplies,Durable Medical Equipment & Medical Supplies,Suppliers,41.30897647044,-105.556215816557
1588879035,COUNTY OF WESTON,"400 STAMPEDE ST, NEWCASTLE, WY 82701",3077464775,Non-Surgical Family Planning Clinic/Center,Clinic/Center,Ambulatory Health Care Facilities,43.844337366378,-104.210697723247
1457565921,EYE CARE OF THE BIG HORNS LLC,"1033 COFFEEN AVE., SHERIDAN, WY 82801",3076740444,Optometrist,Optometrist,Eye and Vision Services Providers,44.787102120698,-106.943795640669
1376757864,"THE ARC OF NATRONA COUNTY, INC.","337 N WOLCOTT ST, CASPER, WY 82601",3075774913,Developmentally Disabled Services Day Training Agency,"Day Training, Developmentally Disabled Services",Agencies,42.853073572897,-106.323692518853
1972717577,DAVE'S DRUG PARTNERSHIP,"1452 JOHNSTON ST, WHEATLAND, WY 82201",3073223425,Pharmacy,Pharmacy,Suppliers,42.050741566717,-104.96055787143
1952515512,THOMPSON CHIROPRACTIC CLINIC,"1330 RIDGE RD, CHEYENNE, WY 82001",3076377055,Rehabilitation Chiropractor,Chiropractor,Chiropractic Providers,41.138710193087,-104.768579849667
1750596649,ASSOCIATES IN THERAPY FOR INFANTS AND CHILDREN LLC,"3718 PIONEER AVE, CHEYENNE, WY 82001",9704202839,Occupational Therapist,Occupational Therapist,"Respiratory, Developmental, Rehabilitative and Restorative Service Providers",41.149840640955,-104.826746605219
1275748956,HIGH PLAINS PHYSICAL THERAPY LIMITED PARTNERSHIP,"920 UPLAND WAY, GREEN RIVER, WY 82935",3078751847,Durable Medical Equipment & Medical Supplies,Durable Medical Equipment & Medical Supplies,Suppliers,41.497798516681,-109.459447722873
1316153836,HILL FAMILY DENTISTRY PC,"1110 BECK AVE, SUITE 1, CODY, WY 82414",3075274455,General Practice Dentistry,Dentist,Dental Providers,44.52490702095,-109.065523999206
1811102536,"BUFFALO SENIOR CENTER, INC.","671 W FETTERMAN ST, BUFFALO, WY 82834",3076849665,Home Health Agency,Home Health,Agencies,44.346592530912,-106.71233299534
1922213537,ONE22 INC,"180 S WILLOW ST, JACKSON, WY 83001",3077394500,Interpreter,Interpreter,Other Service Providers,43.478125047672,-110.758814136149
1962617886,WEST PARK HOSPITAL,"707 SHERIDAN AVE, CODY, WY 82414",3075277501,Case Management Agency,Case Management,Agencies,44.5260948101,-109.074223552333
1336355627,HEART MOUNTAIN EYECARE GROUP,"255 W 3RD ST, POWELL, WY 82435",3077547151,Corneal and Contact Management Optometrist,Optometrist,Eye and Vision Services Providers,44.755574561013,-108.761457659132
1366658601,BIG HORN BASIN MENTAL HEALTH GROUP,"1054 VALI RD, POWELL, WY 82435",3077543860,Clinical Psychologist,Psychologist,Behavioral Health & Social Service Providers,44.728647582647,-108.76255165294
1104032416,"URGENT CARE OF JACKSON HOLE, LLC","1415 SOUTH HIGHWAY 89, JACKSON, WY 83001",3077398999,Family Medicine Physician,Family Medicine,Allopathic & Osteopathic Physicians,43.458944735952,-110.793352060662
1427265180,EYE CARE CLINIC & OPTICAL LLC,"6228 YELLOWSTONE RD, CHEYENNE, WY 82009",3077782771,Eyewear Supplier,Eyewear Supplier,Suppliers,41.176463637519,-104.828661359163
1124235759,"FRONTIER NEUROSCIENCES, LLC","702 PLATINUM DR, CODY, WY 82414",3075781985,Family Medicine Physician,Family Medicine,Allopathic & Osteopathic Physicians,44.521448474176,-109.075397386409
1073720322,THAYNE EMTS,"231 S MAIN ST, THAYNE, WY 83127",3078834383,Land Ambulance,Ambulance,Transportation Services,42.913956383314,-111.000502211065
1558578807,JAMES G RANDOLPH,"151 S 6TH ST, WORLAND, WY 82401",3073478265,Durable Medical Equipment & Medical Supplies,Durable Medical Equipment & Medical Supplies,Suppliers,44.016288553253,-107.961136867791
1285841148,D BRENKERT ORTHO LLC,"7010 YELLOWTAIL RD, #200, CHEYENNE, WY 82009",3076388958,Orthodontics and Dentofacial Orthopedics Dentistry,Dentist,Dental Providers,41.181552915422,-104.827466074177
1821205923,ROCKY MOUNTAIN SPORTS MEDICINE REHABILITATION LLC,"416 W BLAIR AVE, ROCK SPRINGS, WY 82901",3073523626,Physical Therapist,Physical Therapist,"Respiratory, Developmental, Rehabilitative and Restorative Service Providers",41.576536241417,-109.225847707383
1720296130,"WYOMING SPINE AND NEUROSURGERY ASSOCIATES,LLC","1950 BLUEGRASS CIR, STE 170, CHEYENNE, WY 82009",3077782860,Neurological Surgery Physician,Neurological Surgery,Allopathic & Osteopathic Physicians,41.158805973729,-104.793244750533
1841408416,PROFESSIONAL HEARING GROUP,"407 S MEDICAL ARTS CT, SUITE F, GILLETTE, WY 82716",3076823399,Audiologist,Audiologist,"Speech, Language and Hearing Service Providers",44.290906562766,-105.521588095286
1083822795,BIG HORN BASIN PATHOLOGY,"1008 CODY AVE, CODY, WY 82414",3075781850,Clinical Medical Laboratory,Clinical Medical Laboratory,Laboratories,44.52269626924,-109.067558103399
1821206129,"ALPENGLOW WELLNESS, INC.","121 E GRAND AVE, SUITE 216, LARAMIE, WY 82070",3077601998,Community/Behavioral Health Agency,Community/Behavioral Health,Agencies,41.311218786998,-105.595896251418
1275742009,K. DIANE BOCHE,"513 GREYBULL AVE, GREYBULL, WY 82426",3077654700,Public Health or Welfare Agency,Public Health or Welfare,Agencies,44.48879893664,-108.054145778453
1649488743,CHILDREN'S DENTISTRY LLC,"6900 YELLOWTAIL RD STE 100, CHEYENNE, WY 82009",3076359251,Pediatric Dentistry,Dentist,Dental Providers,41.180964489608,-104.827464470211
1821207036,ROY E. PAULSON JR PC,"2805 CEDAR AVE STE A, GILLETTE, WY 82718",3076867635,Pediatric Dentistry,Dentist,Dental Providers,44.268945371623,-105.505242666129
1568671717,GERALD ROWE DMD PC,"229 STOREY BLVD, A, CHEYENNE, WY 82009",3076356300,General Practice Dentistry,Dentist,Dental Providers,41.174849675878,-104.825013809024
1437369279,"D. WAYNE BIRCH, D.D.S., P.C.","661 UINTA DR, GREEN RIVER, WY 82935",3078753658,General Practice Dentistry,Dentist,Dental Providers,41.513216031028,-109.471959411538
1639389281,"CHILD DEVELOPMENT SERVICES OF FREMONT COUNTY, INC.","100 PUSH ROOT CT, LANDER, WY 82520",3073325508,Clinic/Center,Clinic/Center,Ambulatory Health Care Facilities,42.82963085964,-108.724745486004
1316158272,JACKSON PEDIATRICS P.C.,"557 E. BROADWAY, 557 E. BROADWAY, JACKSON, WY 83001",3077334627,Pediatrics Physician,Pediatrics,Allopathic & Osteopathic Physicians,43.479751944322,-110.750681380351
1003027889,STAR VALLEY SENIOR CENTER INC,"520 WASHINGTON, AFTON, WY 83110",3078853780,Case Management Agency,Case Management,Agencies,42.7431776,-110.9341323
1518178359,CASPER MEDICAL CENTER LLC,"6550 E 2ND STREET, CASPER, WY 82609",3079958100,General Acute Care Hospital,General Acute Care Hospital,Hospitals,42.839938164711,-106.22749931169
1538370895,CHEYENNE ASSISTED LIVING & SUPPORT,"807 MITCHELL CT, CHEYENNE, WY 82007",3072569323,Child Intellectual and/or Developmental Disabilities Respite Care,Respite Care,Respite Care Facility,41.109956170013,-104.79660130111
1306057682,RYBEN LLC,"2809 EVANS AVE, CHEYENNE, WY 82001",3076340795,Chiropractor,Chiropractor,Chiropractic Providers,41.145131168213,-104.817702911729
1851502397,"MOUNTAIN REGIONAL SERVICES, INC.","50 ALLEGIANCE CIR, EVANSTON, WY 82930",3077893710,Mental Health Clinic/Center (Including Community Mental Health Center),Clinic/Center,Ambulatory Health Care Facilities,41.260596674219,-110.993850351655
1568663755,D'N'A CASE MANAGEMENT SERVICES,"4412 EVERTON DR, CHEYENNE, WY 82009",3077784102,Case Management Agency,Case Management,Agencies,41.162555276427,-104.755961687852
1083815989,DANIEL L MORIN DDS MS PC,"805 S 4J RD, GILLETTE, WY 82716",3076865665,Orthodontics and Dentofacial Orthopedics Dentistry,Dentist,Dental Providers,44.287338280007,-105.510376268374
1780885228,SHOPKO STORES OPERATING CO LLC,"1105 BRIDGER DR, GREEN RIVER, WY 82935",3078754904,Durable Medical Equipment & Medical Supplies,Durable Medical Equipment & Medical Supplies,Suppliers,41.503316982746,-109.458567130604
1891997151,GRAND TETON MEDICAL CLINIC,"INNER LOOP ROAD, JACKSON LAKE LODGE, MORAN, WY 83013",3075432514,Urgent Care Clinic/Center,Clinic/Center,Ambulatory Health Care Facilities,43.87734469999999,-110.5774838
1285835553,LAYA'S MAIN STREET PHARMACY,"555 N MAIN ST, SHERIDAN, WY 82801",3076723741,Durable Medical Equipment & Medical Supplies,Durable Medical Equipment & Medical Supplies,Suppliers,44.803354598136,-106.955654624843
1144421587,ABLE HANDS,"3405 WHITE MOUNTAIN BLVD, ROCK SPRINGS, WY 82901",3073626029,Developmentally Disabled Services Day Training Agency,"Day Training, Developmentally Disabled Services",Agencies,41.587714921913,-109.258196792956
1578765749,WITH EAGLE'S WINGS,"11 GREAT PLAIN ROAD, ARAPAHOE, WY 82524",3078575940,Substance Use Disorder Rehabilitation Clinic/Center,Clinic/Center,Ambulatory Health Care Facilities,42.985919214723,-108.486093358191
1669674396,"NORTHEAST WYOMING PATHOLOGY, P.C.","501 S BURMA AVE, GILLETTE, WY 82716",8177317771,Anatomic Pathology & Clinical Pathology Physician,Pathology,Allopathic & Osteopathic Physicians,44.290417722206,-105.51945260029
1154523728,"DERRIK WALTON DDS & DARREN J. RUESCH DDS, PC","1525 BLEISTEIN AVE, CODY, WY 82414",3075872951,General Practice Dentistry,Dentist,Dental Providers,44.528316596674,-109.0577415905
1881896694,TETON COUNTY HOSPITAL DISTRICT,"625 EAST BROADWAY, JACKSON, WY 83001",3077333636,General Acute Care Hospital,General Acute Care Hospital,Hospitals,43.47974627978,-110.750194233325
1124220645,"NORTHERN WYOMING OPHTHALMOLOGY, P.C.","424 YELLOWSTONE AVE, SUITE 110, CODY, WY 82414",3075875788,Optician,Technician/Technologist,Eye and Vision Services Providers,44.516760086073,-109.085314649342
1255533626,"CORPORATE PROTECTIVE SERVICES, INC","1705 ALBANY AVE, CHEYENNE, WY 82001",3076357473,Durable Medical Equipment & Medical Supplies,Durable Medical Equipment & Medical Supplies,Suppliers,41.140818275688,-104.795200474191
1750584173,ROY E. PAULSON JR PC,"102 N. KENWOOD ST., CASPER, WY 82601",3072661997,Pediatric Dentistry,Dentist,Dental Providers,42.85018086268,-106.304021412551
1508069741,CAMPBELL COUNTY MEMORIAL HOSPITAL,"501 S BURMA AVE, GILLETTE, WY 82716",3076881000,General Acute Care Hospital,General Acute Care Hospital,Hospitals,44.290417722206,-105.51945260029
1982807848,JENNIFER J. THOMAS MDPC,"1204 W 4TH AVE, SUITE #3, GILLETTE, WY 82716",3076850222,Family Medicine Physician,Family Medicine,Allopathic & Osteopathic Physicians,44.303819557441,-105.520781823436
1982808481,"CHEYENNE WOMENS CLINIC,PC","3952 PARKVIEW DR, CHEYENNE, WY 82001",3076377700,Obstetrics & Gynecology Physician,Obstetrics & Gynecology,Allopathic & Osteopathic Physicians,41.157288435101,-104.764950728088
1528261161,"SAGEBRUSH E.N.T., INC.","1405 W 4TH ST, GILLETTE, WY 82716",3076851442,Hearing  Aid Equipment,Hearing Aid Equipment,Suppliers,44.290978743983,-105.522905002096
1407050875,COMUNITY HEALTH CENTER OF CENTRAL WYOMING,"1522 E A ST, CASPER, WY 82601",3072336000,Ambulatory Fertility Facility,Clinic/Center,Ambulatory Health Care Facilities,42.851531849346,-106.305161955924
1588868707,CURRAN SEELEY FOUNDATION,"610 W. BROADWAY, SUITE L1, JACKSON, WY 83001",3077333908,Substance Use Disorder Rehabilitation Clinic/Center,Clinic/Center,Ambulatory Health Care Facilities,43.477394384897,-110.77154443857
1912101973,CAROL A FISCHER MD PC,"1331 PRAIRIE AVE, SUITE 2, CHEYENNE, WY 82009",3077783121,Family Medicine Physician,Family Medicine,Allopathic & Osteopathic Physicians,41.164016448263,-104.808623075587
1649474362,TETON INTERNAL MEDICINE PC,"555 EAST BROADWAY, SUITE 220, JACKSON, WY 83001",3077337222,Specialist,Specialist,Other Service Providers,43.477001021826,-110.772336092465
1508060153,RAWHIDE DRUG LLC,"232 S MAIN STREET, LUSK, WY 82225",3073343132,Durable Medical Equipment & Medical Supplies,Durable Medical Equipment & Medical Supplies,Suppliers,42.763546725155,-104.452287005934
1821292558,THE CENTER FOR ABILITIES,"107 SHERWOOD CIR, CASPER, WY 82609",3072344401,Developmentally Disabled Services Day Training Agency,"Day Training, Developmentally Disabled Services",Agencies,42.833327286642,-106.280666837407
1700081239,"ALLIANCE PHYSICAL THERAPY, LLC","1977 DEWAR DR, J, ROCK SPRINGS, WY 82901",3073823228,Chiropractor,Chiropractor,Chiropractic Providers,41.574879686698,-109.247223722791
1861698524,HIGH COUNTRY BEHAVIORAL HEALTH,"721 W MAPLE ST, RAWLINS, WY 82301",3073247156,Substance Use Disorder Rehabilitation Clinic/Center,Clinic/Center,Ambulatory Health Care Facilities,41.790871784768,-107.244316536355
1760688188,RIVERTON SENIOR CITIZENS CENTER,"303 E LINCOLN AVE, RIVERTON, WY 82501",3078566332,Voluntary or Charitable Agency,Voluntary or Charitable,Agencies,43.028792128517,-108.387680980575
1932305281,NORTHFORK SPEECH AND HEARING PC,"968 GILCHRIST ST, WHEATLAND, WY 82201",3073223332,Audiologist,Audiologist,"Speech, Language and Hearing Service Providers",42.054413565754,-104.954121313562
1386840429,WINDY CITY WELLNESS PC,"403 STOREY BLVD, CHEYENNE, WY 82009",3076346095,Primary Care Clinic/Center,Clinic/Center,Ambulatory Health Care Facilities,41.174814616137,-104.820656986461
1639375975,"GLENN S. PARRY, DMD, PC","220 SHOSHONE AVE, GREEN RIVER, WY 82935",3078757770,General Practice Dentistry,Dentist,Dental Providers,41.507797135966,-109.469247180264
1720284888,"LARAMIE VALLEY MEDICAL, PC","920 E SHERIDAN ST, SUITE B, LARAMIE, WY 82070",3077429080,Internal Medicine Physician,Internal Medicine,Allopathic & Osteopathic Physicians,41.306695006545,-105.58580614462
1508063991,ABC PEDIATRICS LLC,"1300 W 4TH ST, GILLETTE, WY 82716",3076864900,Rural Health Clinic/Center,Clinic/Center,Ambulatory Health Care Facilities,44.291093335252,-105.521530636775
1538366075,DIANE R EDWARDS,"915 S DAVID ST, CASPER, WY 82601",3074723769,Counselor,Counselor,Behavioral Health & Social Service Providers,42.841424138556,-106.326509912712
1750588851,LEGACY HOME ASSISTED LIVING,"2391 MUDDY STRING CO. ROAD 122, THAYNE, WY 83127",3078833800,Assisted Living Facility,Assisted Living Facility,Nursing & Custodial Care Facilities,42.9527672,-110.9734602
1215135025,SWEETWATER PEDIATRICS P.C.,"1204 HILLTOP DR, SUITE#106, ROCK SPRINGS, WY 82901",3073625500,Primary Care Clinic/Center,Clinic/Center,Ambulatory Health Care Facilities,41.584040266663,-109.232142142545
1053519918,"JACKSON WHOLE FAMILY HEALTH, INC.","1110 MAPLE WAY, JACKSON, WY 83001",3077337003,Family Nurse Practitioner,Nurse Practitioner,Physician Assistants & Advanced Practice Nursing Providers,43.470224282518,-110.787845559829
1659579191,TRENETTE ANN LARSON MD PC,"10115 BRANDING IRON DR, CHEYENNE, WY 82009",3077788437,Internal Medicine Physician,Internal Medicine,Allopathic & Osteopathic Physicians,41.213150119584,-104.796623176654
1972701381,"WYOMING ORTHOPEDIC AND SPORTS MEDICINE, LLC","5050 POWDERHOUSE RD, CHEYENNE, WY 82009",3076337943,Sports Medicine (Orthopaedic Surgery) Physician,Orthopaedic Surgery,Allopathic & Osteopathic Physicians,41.164743206469,-104.809211318818
1164621777,NORTH BIG HORN HOSPITAL DISTRICT,"1115 LANE 12, LOVELL, WY 82431",3075485200,Urgent Care Clinic/Center,Clinic/Center,Ambulatory Health Care Facilities,44.825863401404,-108.391179766715
1073712527,"BODYWORKS PHYSICAL THERAPY, PLLC","745 BUENA VISTA DR, LANDER, WY 82520",2198515270,Physical Therapist,Physical Therapist,"Respiratory, Developmental, Rehabilitative and Restorative Service Providers",42.826191022254,-108.729331729897
1821297102,CAROLJEAN BONGO PSYD LLC,"2909 BENT AVE, CHEYENNE, WY 82001",3077601871,Clinical Psychologist,Psychologist,Behavioral Health & Social Service Providers,41.142299231608,-104.828385321558
1326247479,CHEYENNE OCULAR SURGERY,"1300 E 20TH ST, CHEYENNE, WY 82001",3076322020,Ambulatory Surgical Clinic/Center,Clinic/Center,Ambulatory Health Care Facilities,41.141778573175,-104.802995658941
1891994950,"S48WY1, LLC","231 S. WILSON, CASPER, WY 82601",3072653791,Substance Abuse Rehabilitation Facility,Substance Abuse Rehabilitation Facility,Residential Treatment Facilities,42.848310983145,-106.306676967229
1457551574,SHERIDAN VAMC,"1001 GATEWAY BLVD, ROCK SPRINGS, WY 82901",9135784409,VA Clinic/Center,Clinic/Center,Ambulatory Health Care Facilities,41.586826780649,-109.246566848584
1831399872,CLOUD PEAK FOUNDATION,"1300 COBURN AVE, WORLAND, WY 82401",3073478411,Voluntary or Charitable Agency,Voluntary or Charitable,Agencies,44.015731980256,-107.951556450358
1093914111,"NORTH PLATTE PHYSICAL THERAPY SERVICES, INC.","111 S 5TH ST, DOUGLAS, WY 82633",3073589464,Physical Therapist,Physical Therapist,"Respiratory, Developmental, Rehabilitative and Restorative Service Providers",42.759328676874,-105.381177786985
1720288491,TETON YOUTH AND FAMILY SERVICES,"510 S. CACHE DR., JACKSON, WY 83001",3077336440,Community/Behavioral Health Agency,Community/Behavioral Health,Agencies,43.474340707577,-110.762306141351
1093915746,HEART MOUNTAIN CHIROPRACTIC INC,"1543 BLEISTEIN AVE, CODY, WY 82414",3075275469,Chiropractor,Chiropractor,Chiropractic Providers,44.528319123936,-109.057420624687
1316147952,"JEFFRIES DENTAL, P.C.","3313 PAINTBRUSH LANE, WORLAND, WY 82401",3073473994,General Practice Dentistry,Dentist,Dental Providers,44.02138427977,-107.926290518589
1306046651,"CHEYENNE ORAL & MAXILLOFACIAL SURGERY ASSOCIATES, L.L.C","6238 YELLOWSTONE RD, CHEYENNE, WY 82009",3076356940,Oral and Maxillofacial Surgery Clinic/Center,Clinic/Center,Ambulatory Health Care Facilities,41.176581031966,-104.828660492768
1184814345,PROACTIVE PHYSICAL THERAPY PC,"317 N FALER AVE, PINEDALE, WY 82941",3073676236,Occupational Therapist,Occupational Therapist,"Respiratory, Developmental, Rehabilitative and Restorative Service Providers",42.86903320365,-109.856041729044
1700076643,DAVID R RUSSELL OD,"720 6TH ST, EVANSTON, WY 82930",3077891500,Optometrist,Optometrist,Eye and Vision Services Providers,41.261055887056,-110.966638742524
1942490891,"WIND RIVER HEALTH SYSTEM, INC","511 N 12TH ST E, SUITE B, RIVERTON, WY 82501",3078576685,Federally Qualified Health Center (FQHC),Clinic/Center,Ambulatory Health Care Facilities,43.028684352459,-108.375588304928
1831389584,"SOL DOMUS, INC.","2805 CEDAR AVE STE B, GILLETTE, WY 82718",3076871100,Developmentally Disabled Services Day Training Agency,"Day Training, Developmentally Disabled Services",Agencies,44.268945371623,-105.505242666129
1467642884,"LANDER MEDICAL CLINIC, P.C.","745 BUENA VISTA DR, LANDER, WY 82520",3073322941,Durable Medical Equipment & Medical Supplies,Durable Medical Equipment & Medical Supplies,Suppliers,42.826191022254,-108.729331729897
1013108265,GASDOC PC,"1233 E 2ND ST, CASPER, WY 82601",3075777201,Anesthesiology Physician,Anesthesiology,Allopathic & Osteopathic Physicians,42.848710980844,-106.308874923041
1881885184,"ESSILOR LABORATORIES OF AMERICA, INC","1905 E A ST, CASPER, WY 82601",8004383413,Eyewear Supplier,Eyewear Supplier,Suppliers,42.851410979771,-106.299550341578
1578754487,"SCOTT N BATEMAN, MD","330 W DOW ST, SHERIDAN, WY 82801",3076720290,Hearing  Aid Equipment,Hearing Aid Equipment,Suppliers,44.802453889857,-106.960457797654
1306037296,SUBURBAN UROLOGY NETWORK PLLC,"557 E BROADWAY, JACKSON, WY 83001",3077341525,Urology Physician,Urology,Allopathic & Osteopathic Physicians,43.479751944322,-110.750681380351
1841481603,"YOUTH CRISIS CENTER, INC.","915 S MCKINLEY ST, CASPER, WY 82601",3075775718,Psychiatric Residential Treatment Facility,Psychiatric Residential Treatment Facility,Residential Treatment Facilities,42.841433007217,-106.3123634281
1902097637,"SPINE & INJURY CLINIC OF LARAMIE, PC","3905 E GRAND AVE STE 200, LARAMIE, WY 82070",3077422082,Chiropractor,Chiropractor,Chiropractic Providers,41.306045395754,-105.545219724579
1306037817,TEN SLEEP AMBULANCE SERVICE,"415 5TH STREET, TEN SLEEP, WY 82442",3073662265,Land Ambulance,Ambulance,Transportation Services,44.036660010163,-107.446841387385
1295927655,"SPECIALISTS IN OBSTETRICS AND GYNECOLOGY, P.C.","1414 W 4TH ST, OBGYN SPECIALISTS, GILLETTE, WY 82716",3076863855,Obstetrics Physician,Obstetrics & Gynecology,Allopathic & Osteopathic Physicians,44.291092518807,-105.522990564099
1083806111,"TOTAL FAMILY HEALTH, PC","2620 COMMERCIAL WAY, SUITE 051, ROCK SPRINGS, WY 82901",3073822080,Family Nurse Practitioner,Nurse Practitioner,Physician Assistants & Advanced Practice Nursing Providers,41.581805992145,-109.255749708537
1386836302,"CLEAR IMAGE VISION CARE, P.C.","610 S 12TH ST, WORLAND, WY 82401",3073474151,Optometrist,Optometrist,Eye and Vision Services Providers,44.011032053303,-107.95372884993
1366634396,WYOMING WIC PROGRAM,"6101 YELLOWSTONE ROAD, SUITE 510, CHEYENNE, WY 82002",3077777494,Public Health or Welfare Agency,Public Health or Welfare,Agencies,41.174960352033,-104.828520211599
1508058173,HIGH COUNTRY BEHAVIORAL HEALTH,"24 COUNTRY CLUB LANE, PINEDALE, WY 82941",3073672111,Mental Health Clinic/Center (Including Community Mental Health Center),Clinic/Center,Ambulatory Health Care Facilities,42.86628245247,-109.877390052643
1801088497,CHILDREN'S DEVELOPMENTAL SERVICES OF CAMPBELL COUNTY,"1801 S 4J RD, GILLETTE, WY 82718",3076822392,Clinic/Center,Clinic/Center,Ambulatory Health Care Facilities,44.278730350715,-105.509617279092
1114119799,WASHAKIE MEDICAL CENTER,"400 S 15TH ST, WORLAND, WY 82401",3073476952,Critical Access Hospital,General Acute Care Hospital,Hospitals,44.01369830137,-107.94846723359
1902098528,"LANDER DENTAL GROUP,PC","799 S 2ND ST, LANDER, WY 82520",3073327710,Dentist,Dentist,Dental Providers,42.82525305764,-108.732024709338
1659564185,"LANDER VALLEY CHIROPRACTIC, INC.","202 E PERSHING BLVD, CHEYENNE, WY 82001",3076354878,Clinic/Center,Clinic/Center,Ambulatory Health Care Facilities,41.146025674475,-104.821012451375
1053503565,"FRONTIER WYOMING, L.L.C.","230 N 1ST ST, LANDER, WY 82520",3073322922,Case Management Agency,Case Management,Agencies,42.833880242649,-108.726632007793
1255524674,"FRONTIER WYOMING, L.L.C.","907 N POPLAR ST, SUITE 277, CASPER, WY 82601",3072346684,Home Health Agency,Home Health,Agencies,42.859695492161,-106.332573167405
1780877894,HIGH COUNTRY BEHAVIORAL HEALTH,"721 W MAPLE ST, RAWLINS, WY 82301",3073247156,Nursing Care Agency,Nursing Care,Agencies,41.790871784768,-107.244316536355
1942493077,"DR. DAVID KRISE DDS,LLC","799 S 2ND ST, LANDER, WY 82520",3073493308,Pediatric Dentistry,Dentist,Dental Providers,42.82525305764,-108.732024709338
1265625297,WYOMING EYE & LASER INC.,"1005 COLLEGE VIEW DR, RIVERTON, WY 82501",3073714294,Ophthalmology Physician,Ophthalmology,Allopathic & Osteopathic Physicians,43.034784139647,-108.420341167159
1083807036,"FRONTIER WYOMING, L.L.C.","907 N POPLAR ST, SUITE 277, CASPER, WY 82601",3072346684,Community Based Hospice Care Agency,"Hospice Care, Community Based",Agencies,42.859695492161,-106.332573167405
1699968404,HOMESTEAD PHYSICAL THERAPY PC,"1575 N 4TH ST, SUITE 101, LARAMIE, WY 82072",3077455434,Physical Therapy Clinic/Center,Clinic/Center,Ambulatory Health Care Facilities,41.326927921049,-105.590508734976
1033302856,YOUR FAMILY OPTICAL,"4214 CHEYENNE ST, CHEYENNE, WY 82001",3076380260,Optician,Technician/Technologist,Eye and Vision Services Providers,41.147470231591,-104.758540810526
1558554113,"ALTITUDE ANALYSIS, INC","2528 FOOTHILL BLVD STE A, ROCK SPRINGS, WY 82901",3073624552,Clinical Medical Laboratory,Clinical Medical Laboratory,Laboratories,41.581637989674,-109.259307059394
1801089404,GENOA HEALTHCARE LLC,"510 W 29TH ST STE P, CHEYENNE, WY 82001",3077783818,Durable Medical Equipment & Medical Supplies,Durable Medical Equipment & Medical Supplies,Suppliers,41.142985892847,-104.826359931335
1144414780,TETON YOUTH AND FAMILY SERVICES,"7905 S. FALL CREEK RD., WILSON, WY 83014",3077339098,Emotionally Disturbed Childrens' Residential Treatment Facility,"Residential Treatment Facility, Emotionally Disturbed Children",Residential Treatment Facilities,43.366273748213,-110.837941899373
1003000688,HUSSKE CHIROPRACTIC CLINIC,"1265 COFFEEN AVE, SHERIDAN, WY 82801",3076747433,Chiropractor,Chiropractor,Chiropractic Providers,44.786337268815,-106.943096726342
1841484243,"FRONTIER WYOMING, L.L.C.","230 N 1ST ST, LANDER, WY 82520",3073322922,Community Based Hospice Care Agency,"Hospice Care, Community Based",Agencies,42.833880242649,-108.726632007793
1831383264,"ANESTHESIA SERVICES OF JACKSONHOLE, P.C.","970 W BROADWAY # 378, JACKSON, WY 83001",3077346956,Anesthesiology Physician,Anesthesiology,Allopathic & Osteopathic Physicians,43.479636773764,-110.743555782581
1952595043,TOWN OF HANNA,"111 2ND ST, HANNA, WY 82327",3073259665,Ambulance,Ambulance,Transportation Services,41.8694056,-106.5585484
